{
  "normRef": {
    "doc": "ГОСТ Р 52290-2024",
    "clause": "п. 3.14–3.16"
  },
  "verification": "CuratorExtracted",
  "markers": [
    "GOST-001",
    "GOST-008",
    "GOST-006"
  ],
  "outerBorderWidthMm": [
    {
      "signs": "1.1 - 2.4, 2.6, 3.2 - 3.35, 4.8.1 - 4.8.3, 5.23.2, 5.24.2, 6.13, 6.15.1 - 6.16.1, 6.18.1 - 6.22",
      "value": 10
    },
    {
      "signs": "2.5, 2.7, 3.1, 4.1.1 - 4.7, 5.1 - 5.22, 5.27 - 5.42, 6.1 - 6.8.3, 7.1 - 7.20",
      "value": 20
    }
  ],
  "plateBorderWidthMm": [
    {
      "signs": "8.1.1 - 8.26",
      "value": 10
    }
  ],
  "redBorderInnerCornerRadiusMm": [
    {
      "signs": "1.1, 1.2, 1.5 - 1.33, 2.3.1 - 2.4",
      "value": 10
    }
  ],
  "outerBorderMayBeOmitted": {
    "signs": "1.1 - 1.3.2, 1.5 - 1.32, 2.3.1 - 2.4, 2.6, 3.2 - 3.20, 3.22, 3.24, 3.26 - 3.30, 3.32 - 3.35",
    "condition": "при соответствующем увеличении ширины внутренней каймы"
  },
  "innerBorderWidthMm": null,
  "innerBorderWidthNote": "Ширина внутренней (красной) каймы — только на рисунках прил. Д; нужен GOST-маркер",
  "innerBorderWidthRatio": [
    {
      "signs": "2.3.1 - 2.4",
      "value": 0.075,
      "note": "Красная кайма треугольника: 7–8 % стороны (curator-measure, прил. А стр. 31)."
    },
    {
      "signs": "3.2 - 3.35",
      "value": 0.087,
      "note": "Красная кайма круга: ≈0,087·D (curator-measure, прил. А стр. 35; проверка метода — белая кайма 3.24 ≈10 мм по п. 3.14)."
    }
  ],
  "innerBorderWidthRatioNote": "Временная пропорция вместо неизвестной ширины в мм: ширина = доля · меньшая сторона поля знака. Статус Unverified, норма — масштабная сетка прил. Б (GOST-001). Сверяет студент.",
  "tolerances": {
    "borderSymbolsLettersDigitsMm": 1,
    "fieldMm": 3,
    "individualDesignFieldMm": 5,
    "angularDeg": 2
  }
}
